id,scheda,nctn,inventario,suffisso,cmpd,titolo,deso,l3,l4,piano,sala,contenitore,comune,via,geonote,dtzgi,dtzgf,dtzs,dtsi,dtsf,stcc,oss
115,,349292,135160,,09/11/2020,Melillo-349292,"Anello in argento caratterizzato da verga irregolare che si assottiglia inferiormente per un breve tratto, profilo esterno arrotondato, piatta all'interno. Presenta un castone a scarabeo mobile in calcedonio di colore viola pallido; la linea dorsale dello scarabeo è resa con una fila di minuti rettangoli e ai margini delle ali serie di linee incise; la base è liscia e leggermente convessa. Sulla faccia piatta, delimitata da una linea incisa, è riprodotta una figura fantastica, con testa, busto e braccia femminili, corpo di uccello dalla coda piumata e zampe di quadrupede. L'incisione è in stile ""a globuli"". Risulta un intervento di restauro sulla verga spezzata. Rinvenuto il 23.06.1969 in una tomba di contrada Pizzone a Taranto.",4,28,1,7,11,108,,Contrada Pizzone,33,33,2,310,301,4,
464,,349626,8174,,10/11/2020,Melillo-349626,Piede di vaso in bronzo. Caratterizzato da una serie di puntini intorno all'attaccatura con il corpo del vaso. Leggermente corroso. Il reperto proviene da una tomba lucana rinvenuta nella proprietà di Andrea Di Ciancia a Roccanova (PZ) e acquistata dal Museo il 29.01.1910.,43,607,1,17,fuori vetrina,108,,,26,26,,,,8,scavo del 1910. Acquisto del 1910
465,,349627,8175,,11/11/2020,Melillo-349627,Piede di un grande vaso in bronzo. Caratterizzato da una forma sagomata. Il reperto proviene da una tomba lucana rinvenuta nella proprietà di Andrea Di Ciancia a Roccanova (PZ) e acquistata dal Museo il 29.01.1910.,43,607,1,17,fuori vetrina,108,,,26,26,,,,8,scavo del 1910. Acquisto del 1910
466,,349628,8176,,12/11/2020,Melillo-349628,"Piede di vaso in bronzo. Caratterizzato da un alto gambo. La base del piede è decorata con un motivo a baccellatura; vicino all'attacco del gambo, due sottili cercini con motivi ad ovoli. Molto ossidato. Il reperto proviene da una tomba lucana rinvenuta nella proprietà di Andrea Di Ciancia a Roccanova (PZ) e acquistata dal Museo il 29.01.1910.",43,607,1,17,fuori vetrina,108,,,26,26,,,,8,scavo del 1910. Acquisto del 1910
489,,349629,8227,,13/11/2020,Melillo-349629,"Piede di vaso in bronzo, frammentato da una parte. In pessimo stato di conservazione. Il reperto proviene da una tomba lucana rinvenuta nella proprietà di Andrea Di Ciancia a Roccanova (PZ) e acquistata dal Museo il 29.01.1910.",43,607,1,17,fuori vetrina,108,,,26,26,,,,8,scavo del 1910. Acquisto del 1910
453,,349630,8139,,14/11/2020,Melillo-349630,"Orlo e manico di situla. Manico ad arco, movibile, ornato nella parte inferiore da ovoli e da due palmette. Il reperto proviene da una tomba lucana rinvenuta nella proprietà di Andrea Di Ciancia a Roccanova (PZ) e acquistata dal Museo il 29.01.1910.",43,590,1,17,fuori vetrina,108,,,26,26,,,,8,scavo del 1910. Acquisto del 1910
451,,349631,8137,,15/11/2020,Melillo-349631,"Ansa di hydria in bronzo. Ansa ad anello, terminante con due borchie a baccellatura leggermete consunta. Il reperto proviene da una tomba lucana rinvenuta nella proprietà di Andrea Di Ciancia a Roccanova (PZ) e acquistata dal Museo il 29.01.1910.",43,517,1,17,fuori vetrina,108,,,26,26,,,,8,scavo del 1910. Acquisto del 1910
452,,349632,8138,,16/11/2020,Melillo-349632,"Ansa di hydria in bronzo. Ansa a bastoncello, leggermente piegata superiormente con due larghe borchie a baccellatura. Il reperto proviene da una tomba lucana rinvenuta nella proprietà di Andrea Di Ciancia a Roccanova (PZ) e acquistata dal Museo il 29.01.1910.",43,517,1,17,fuori vetrina,108,,,26,26,,,,8,scavo del 1910. Acquisto del 1910
455,,349633,8149,,17/11/2020,Melillo-349633,"Ansa di hydria in bronzo. Di forma trilobare, leggermente rialzata, terminante da due larghe borchie, decorata a baccellatura. Il reperto proviene da una tomba lucana rinvenuta nella proprietà di Andrea Di Ciancia a Roccanova (PZ) e acquistata dal Museo il 29.01.1910.",43,517,1,17,fuori vetrina,108,,,26,26,,,,8,scavo del 1910. Acquisto del 1910
456,,349634,8150,,18/11/2020,Melillo-349634,Ansa in bronzo. A cerniera snodabile e a forma di colonnina con motivi ad ovoli. Il reperto proviene da una tomba lucana rinvenuta nella proprietà di Andrea Di Ciancia a Roccanova (PZ) e acquistata dal Museo il 29.01.1910.,43,607,1,17,fuori vetrina,108,,,26,26,,,,8,scavo del 1910. Acquisto del 1910
457,,349635,8151,,19/11/2020,Melillo-349635,Ansa in bronzo. Simile all'ansa n. 8150. A cerniera snodabile e a forma di colonnina con motivi ad ovoli. Il reperto proviene da una tomba lucana rinvenuta nella proprietà di Andrea Di Ciancia a Roccanova (PZ) e acquistata dal Museo il 29.01.1910.,43,607,1,17,fuori vetrina,108,,,26,26,,,,8,scavo del 1910. Acquisto del 1910
449,,349636,8135,,20/11/2020,Melillo-349636,Ansa di vaso in bronzo. Caratterizzato da un motivo ad ovoli inciso nella parte alta. Il reperto proviene da una tomba lucana rinvenuta nella proprietà di Andrea Di Ciancia a Roccanova (PZ) e acquistata dal Museo il 29.01.1910.,43,607,1,17,fuori vetrina,108,,,26,26,,,,8,scavo del 1910. Acquisto del 1910
450,,349637,8136,,21/11/2020,Melillo-349637,Ansa di vaso in bronzo. Simile all'ansa n. 8135. Caratterizzato da un motivo ad ovoli inciso nella parte alta. Il reperto proviene da una tomba lucana rinvenuta nella proprietà di Andrea Di Ciancia a Roccanova (PZ) e acquistata dal Museo il 29.01.1910.,43,607,1,17,fuori vetrina,108,,,26,26,,,,8,scavo del 1910. Acquisto del 1910
462,,349638,8158,,22/11/2020,Melillo-349638,"Strigile in bronzo. Ricomposto da due pezzi. Anteriormente sul manico c'è una figuretta fliacica, fra due linee incise orizzontalmente. Il reperto proviene da una tomba lucana rinvenuta nella proprietà di Andrea Di Ciancia a Roccanova (PZ) e acquistata dal Museo il 29.01.1910.",49,764,1,17,fuori vetrina,108,,,26,26,,,,4,scavo del 1910. Acquisto del 1910
470,,349639,8187,,23/11/2020,Melillo-349639,Peso in piombo. A forma di piramidetta con foro di sospensione nella parte alta. Il reperto proviene da una tomba lucana rinvenuta nella proprietà di Andrea Di Ciancia a Roccanova (PZ) e acquistata dal Museo il 29.01.1910.,33,258,1,17,fuori vetrina,108,,,26,26,,,,1,scavo del 1910. Acquisto del 1910
471,,349640,8188,,24/11/2020,Melillo-349640,Peso in piombo. Simile al peso n. 8187. A forma di piramidetta con foro di sospensione nella parte alta. Il reperto proviene da una tomba lucana rinvenuta nella proprietà di Andrea Di Ciancia a Roccanova (PZ) e acquistata dal Museo il 29.01.1910.,33,258,1,17,fuori vetrina,108,,,26,26,,,,1,scavo del 1910. Acquisto del 1910
472,,349641,8189,,25/11/2020,Melillo-349641,Peso in piombo. Simile al peso n. 8187. A forma di piramidetta con foro di sospensione nella parte alta. Il reperto proviene da una tomba lucana rinvenuta nella proprietà di Andrea Di Ciancia a Roccanova (PZ) e acquistata dal Museo il 29.01.1910.,33,258,1,17,fuori vetrina,108,,,26,26,,,,1,scavo del 1910. Acquisto del 1910
473,,349642,8190,,26/11/2020,Melillo-349642,Peso in piombo. Simile al peso n. 8187. A forma di piramidetta con foro di sospensione nella parte alta. Il reperto proviene da una tomba lucana rinvenuta nella proprietà di Andrea Di Ciancia a Roccanova (PZ) e acquistata dal Museo il 29.01.1910.,33,258,1,17,fuori vetrina,108,,,26,26,,,,1,scavo del 1910. Acquisto del 1910
445,,349643,6464,,27/11/2020,Melillo-349643,"Pendente in ambra. Elemento di collana. A forma di grappolo d'uva con acini a rilievo. Il foro di sospensione, a forma di canale, è posto trasversalmente sulla sommità. Il reperto proviene da una tomba lucana rinvenuta nella proprietà di Andrea Di Ciancia a Roccanova (PZ) e acquistata dal Museo il 29.01.1910.",4,44,1,17,fuori vetrina,108,,,26,26,,,,1,scavo del 1910. Acquisto del 1910
446,,349644,6465,,28/11/2020,Melillo-349644,"Pendente in ambra, elemento di collana. A forma di testa femminile di prospetto con alto copricapo di tipo egizio. I tratti fisionomici schematici, ma espressivi, sono resi con mano sicura; i capelli ad onde equidistanti incornicianti la parte superiore della testa, grandissimi occhi obliqui molto larghi, naso piatto molto allargato alla base, bocca dritta con labbra sottili. Il reperto proviene da una tomba lucana rinvenuta nella proprietà di Andrea Di Ciancia a Roccanova (PZ) e acquistata dal Museo il 29.01.1910.",4,44,1,17,fuori vetrina,108,,,26,26,,,,1,scavo del 1910. Acquisto del 1910
475,,349645,8210,,29/11/2020,Melillo-349645,"Pendente in ambra. A forma di testa femminile di prospetto, mancante di una parte. Lateralmente, nella faccia inferiore, è attraversato da un canaletto. Il reperto proviene da una tomba lucana rinvenuta nella proprietà di Andrea Di Ciancia a Roccanova (PZ) e acquistata dal Museo il 29.01.1910.",4,44,1,17,fuori vetrina,108,,,26,26,,,,3,scavo del 1910. Acquisto del 1910
476,,349646,8211,,30/11/2020,Melillo-349646,"Pendente in ambra. A forma di testa femminile di prospetto. Rotto nella parte superiore, dove è un foro di sospensione nel mento. Il reperto proviene da una tomba lucana rinvenuta nella proprietà di Andrea Di Ciancia a Roccanova (PZ) e acquistata dal Museo il 29.01.1910.",4,44,1,17,fuori vetrina,108,,,26,26,,,,3,scavo del 1910. Acquisto del 1910
477,,349647,8212,,01/12/2020,Melillo-349647,"Elemento cilindrico in osso. Caratterizzato da anelli plastici, con due fori, uno dei quali è rotto. Forse serviva o per rivestimento di un letto funebre oppure era parte di un flauto. Il reperto proviene da una tomba lucana rinvenuta nella proprietà di Andrea Di Ciancia a Roccanova (PZ) e acquistata dal Museo il 29.01.1910.",65,914,1,17,fuori vetrina,108,,,26,26,,,,8,scavo del 1910. Acquisto del 1910
478,,349648,8213,,02/12/2020,Melillo-349648,"Elemento cilindrico in osso. Simile al reperto nn. 8212-8221. Caratterizzato da anelli plastici, con un foro. Forse serviva o per rivestimento di un letto funebre oppure era parte di un flauto. Superficie consunta. Il reperto proviene da una tomba lucana rinvenuta nella proprietà di Andrea Di Ciancia a Roccanova (PZ) e acquistata dal Museo il 29.01.1910.",65,914,1,17,fuori vetrina,108,,,26,26,,,,8,scavo del 1910. Acquisto del 1910
479,,349649,8215,,03/12/2020,Melillo-349649,"Elemento cilindrico in osso. Simile ai reperti nn. 8212-8221. Caratterizzato da anelli plastici, con un foro. Forse serviva o per rivestimento di un letto funebre oppure era parte di un flauto. Superficie consunta. Il reperto proviene da una tomba lucana rinvenuta nella proprietà di Andrea Di Ciancia a Roccanova (PZ) e acquistata dal Museo il 29.01.1910.",65,914,1,17,fuori vetrina,108,,,26,26,,,,8,scavo del 1910. Acquisto del 1910
480,,349650,8216,,04/12/2020,Melillo-349650,"Elemento cilindrico in osso. Simile ai reperti nn. 8212-8221. Caratterizzato da anelli plastici, con un foro. Forse serviva o per rivestimento di un letto funebre oppure era parte di un flauto. Superficie consunta. Il reperto proviene da una tomba lucana rinvenuta nella proprietà di Andrea Di Ciancia a Roccanova (PZ) e acquistata dal Museo il 29.01.1910.",65,914,1,17,fuori vetrina,108,,,26,26,,,,8,scavo del 1910. Acquisto del 1910
481,,349651,8217,,05/12/2020,Melillo-349651,"Elemento cilindrico in osso. Simile ai reperti nn. 8212-8221. Caratterizzato da anelli plastici, con un foro. Forse serviva o per rivestimento di un letto funebre oppure era parte di un flauto. Superficie consunta. Il reperto proviene da una tomba lucana rinvenuta nella proprietà di Andrea Di Ciancia a Roccanova (PZ) e acquistata dal Museo il 29.01.1910.",65,914,1,17,fuori vetrina,108,,,26,26,,,,8,scavo del 1910. Acquisto del 1910
482,,349652,8218,,06/12/2020,Melillo-349652,"Elemento cilindrico in osso. Simile ai reperti nn. 8212-8221. Caratterizzato da anelli plastici, con un foro. Forse serviva o per rivestimento di un letto funebre oppure era parte di un flauto. Superficie consunta. Il reperto proviene da una tomba lucana rinvenuta nella proprietà di Andrea Di Ciancia a Roccanova (PZ) e acquistata dal Museo il 29.01.1910.",65,914,1,17,fuori vetrina,108,,,26,26,,,,8,scavo del 1910. Acquisto del 1910
483,,349653,8219,,07/12/2020,Melillo-349653,"Elemento cilindrico in osso. Simile ai reperti nn. 8212-8221. Caratterizzato da anelli plastici, con un foro. Forse serviva o per rivestimento di un letto funebre oppure era parte di un flauto. Superficie consunta. Il reperto proviene da una tomba lucana rinvenuta nella proprietà di Andrea Di Ciancia a Roccanova (PZ) e acquistata dal Museo il 29.01.1910.",65,914,1,17,fuori vetrina,108,,,26,26,,,,8,scavo del 1910. Acquisto del 1910
484,,349654,8220,,08/12/2020,Melillo-349654,"Elemento cilindrico in osso. Simile ai reperti nn. 8212-8221. Caratterizzato da anelli plastici, con un foro. Forse serviva o per rivestimento di un letto funebre oppure era parte di un flauto. Superficie consunta. Il reperto proviene da una tomba lucana rinvenuta nella proprietà di Andrea Di Ciancia a Roccanova (PZ) e acquistata dal Museo il 29.01.1910.",65,914,1,17,fuori vetrina,108,,,26,26,,,,8,scavo del 1910. Acquisto del 1910
485,,349655,8221,,09/12/2020,Melillo-349655,"Elemento cilindrico in osso. Simile ai reperti nn. 8212-8221. Caratterizzato da anelli plastici, con un foro. Forse serviva o per rivestimento di un letto funebre oppure era parte di un flauto. Superficie consunta. Il reperto proviene da una tomba lucana rinvenuta nella proprietà di Andrea Di Ciancia a Roccanova (PZ) e acquistata dal Museo il 29.01.1910.",65,914,1,17,fuori vetrina,108,,,26,26,,,,8,scavo del 1910. Acquisto del 1910
486,,349656,8222,,10/12/2020,Melillo-349656,"Elemento cilindrico in osso. Simile ai reperti nn. 8212-8221. Caratterizzato da anelli plastici, con un foro. Forse serviva o per rivestimento di un letto funebre oppure era parte di un flauto. Superficie consunta. Il reperto proviene da una tomba lucana rinvenuta nella proprietà di Andrea Di Ciancia a Roccanova (PZ) e acquistata dal Museo il 29.01.1910.",65,914,1,17,fuori vetrina,108,,,26,26,,,,8,scavo del 1910. Acquisto del 1910
487,,349657,8223,,11/12/2020,Melillo-349657,"Frammenti di elemento cilindrico in osso. Simile ai reperti nn. 8212-8221. Caratterizzato da anelli plastici, con un foro. Forse serviva o per rivestimento di un letto funebre oppure era parte di un flauto. Superficie consunta. Il reperto proviene da una tomba lucana rinvenuta nella proprietà di Andrea Di Ciancia a Roccanova (PZ) e acquistata dal Museo il 29.01.1910.",65,914,1,17,fuori vetrina,108,,,26,26,,,,8,scavo del 1910. Acquisto del 1910
469,,349658,8184,,12/12/2020,Melillo-349658,Placchetta in osso. Di colore verde con decorazione lineare. Al centro longitudinalmente c'è un'apertura rettangolare. Il reperto proviene da una tomba lucana rinvenuta nella proprietà di Andrea Di Ciancia a Roccanova (PZ) e acquistata dal Museo il 29.01.1910.,46,724,1,17,fuori vetrina,108,,,26,26,,,,8,scavo del 1910. Acquisto del 1910
488,,349659,8224,,13/12/2020,Melillo-349659,"Placchetta in osso. Caratterizzata da decorazione reticola incisa; al centro, longitudinalmente c'è un'apertura rettangolare. Il reperto proviene da una tomba lucana rinvenuta nella proprietà di Andrea Di Ciancia a Roccanova (PZ) e acquistata dal Museo il 29.01.1910.",46,724,1,17,fuori vetrina,108,,,26,26,,,,8,scavo del 1910. Acquisto del 1910
491,,349660,8232,,14/12/2020,Melillo-349660,Placchetta in osso di forma rettangolare. Il reperto proviene da una tomba lucana rinvenuta nella proprietà di Andrea Di Ciancia a Roccanova (PZ) e acquistata dal Museo il 29.01.1910.,46,724,1,17,fuori vetrina,108,,,26,26,,,,8,scavo del 1910. Acquisto del 1910
492,,349661,8233,,15/12/2020,Melillo-349661,Placchetta in osso di forma rettangolare. Presenta un foro e un reticolato inciso. Il reperto proviene da una tomba lucana rinvenuta nella proprietà di Andrea Di Ciancia a Roccanova (PZ) e acquistata dal Museo il 29.01.1910.,46,724,1,17,fuori vetrina,108,,,26,26,,,,8,scavo del 1910. Acquisto del 1910
448,,349662,8133,,16/12/2020,Melillo-349662,"Nestoris lucana a figure rosse. Argilla chiara con ingubbiatura rosata. Restaurata e ricomposta da vari frammenti. Le rotelle sono decorate con rosette. Sul collo motivo a serpentelli e motivo ad onda; motivo a palmette e spirali floreali. Sulle spalle, motivo a finta baccellatura; sotto la zona figurata, meandro, interrotto da riquadri crociati; sotto le anse palmette con volute floreali lateralmente. Lato A: giovane seduto, su un rialzo del terreno, rappresentato da punti gialli; ha la parte inferiore del corpo avvolta in un mantello, in testa porta una benda e con la mano detra porge un kalathos. Di fronte sta una giovane donna, vestita di chitone, cinta alla vita; ha in testa una benda e indossa collana e bracciali; ha nella destra una situal e nella sinistra un cembalo, ornato da nastri; dietro al giovane seduto è un'altra donna, avvolta nell'himation, nell'atto di mettere una corona sulla testa del giovane. Lato B: al centro, giovane nudo volto a sinistra, seduto su un pilastro, ha in testa una benda, la mano sinistra è appoggiata ad un bastone e con la destra tiene una corona. Davanti sta una fanciulla, con cuffia e chitone cinto; ha nella destra un cestino con manico ad arco e nella sinistra un cembalo, ornato da nastri. Dietro al giovane seduto, una fanciulla volta a sinistra, in atto di guardarsi in uno specchio che tiene nella mano destra; a terra è una cista; nel campo un disco crociato ed una finestra. Il reperto proviene da una tomba lucana rinvenuta nella proprietà di Andrea Di Ciancia a Roccanova (PZ) e acquistata dal Museo il 29.01.1910.",43,546,1,17,fuori vetrina,108,,,26,26,,,,4,scavo del 1910. Acquisto del 1910
459,,349663,8153,,17/12/2020,Melillo-349663,"Lebete nuziale lucano a figure rosse. Due alte anse cordonate, impostate verticalmente sulle spalle, con bastoncelli dipinti agli attacchi, sono sormontate e affiancate da pannelli. Lato A: un efebo con la spalla e il braccio sinistro coperti dalla clamide, alza la destra in atto di paralre ad una figura femminile, vestita di chitone ed himation che scendendole dalla testa le si avvolve alle braccia. Alla scena assiste un'altra fanciulla, con cofanetto in mano. Ha una benda radiata tra i capelli e veste il chitone con il kolpos. Nel campo, due timpani e rosette. La scena è delimitata in alto da motivi florelali stilizzati, in basso da meandro, interrotto da riquadri segnati co una croce. Restaurato al piede a alle anse. Lato B: un efebo con clamide poggiata sulla spalla e sul braccio sinistro, ha depositato un oggetto su una stele, mentre una fanciulla in chitone dorico, con la mano protesa, porge un grosso fiore. Dalla destra avanza un'altra figura femminile che porta un timpano nella mano alzata. Nel campo, timpani e rosette. Sotto le anse, grande motivo decorativo costituito da una palmetta con volute e fiori campanulati. Il coperchio è sormontato da un altro lebete (alto cm 20). Sulla costolatura del piede, motivo a bastoncello; inferiormente motivo a onda. Palmette e girali, sotto le anse, impostate verticalmente. Uno dei manichetti è restaurato. LAto A: efebo nudo volto a sinistra. Lato B: fanciulla vestita di chitone dorico con una patera nella mano destra. Sulle spalle bastoncelli. Il reperto proviene da una tomba lucana rinvenuta nella proprietà di Andrea Di Ciancia a Roccanova (PZ) e acquistata dal Museo il 29.01.1910.",43,535,1,17,fuori vetrina,108,,,26,26,,,,1,scavo del 1910. Acquisto del 1910
458,,349665,8151,,19/12/2020,Melillo-349665,"Anfora lucana a figure rosse. Zona risparmiata sopra il piede. Sul collo ramo di alloro; sulla spalla bastoncelli. Lato A: ai fianchi di un louterion (vasca lustrale), dal piede a colonnetta ionica, sono presenti: a destra un efebo nudo con il mantello avvolto intorno al braccio sinistro e una corona nella destra; a sinistra una fanciulla con il chitone dorico, che regge un timpano. Lato B: conversazione tra un rabdoforo e un efebo ammantato che tiene nella destra alzata una corona. Sotto le anse due palmette sovrapposte con foglie ovali. Il reperto proviene da una tomba lucana rinvenuta nella proprietà di Andrea Di Ciancia a Roccanova (PZ) e acquistata dal Museo il 29.01.1910.",43,447,1,17,fuori vetrina,108,,,26,26,,,,1,scavo del 1910. Acquisto del 1910
454,,349666,8144,,20/12/2020,Melillo-349666,"Pelike lucana a figure rosse. Sul collo ramo di lauro e motivo ad ovuli. Sulle spalle, lato A, grande decorazione di palmette e volute con girali fogliati; lato B: motivo a goccia. Lato A: quadro limitato un motivo corrente e meandro, con rappresentazione di personaggi. Nel mezzo figura femminile con chitone dorico e con uno specchio nella destra ed una phiale baccellata nella sinistra, ai suoi piedi è un kalathos. Dinanzi a lui sta un efebo con la clamide sull'avambraccio sinistro e con il braccio destro disteso come per deporre nella phiale della donzella alcuni pomi. Dietro all'efebo è una fanciulla vestita di chitone e himation, con una cassetta nella mano su cui sono dei fiori. A sinistra della figura centrale è un'altra coppia di efebo con una fanciulla, la quale porta in mano una cassetta e l'efebo che le sta di fronte, ha l'avambraccio sinistro avvolto nella clamide e nella destra un peplo. Lato B: quattro figure femminili distribuite su piani diversi, tre hanno il chitone e giocano a palla ed una indossa anche l'himation e in mano ha una benda. Nel campo un lebete e un louterion e una cassetta; uno specchio e diversi circoli crociati. Sotto l'ansa, palmetta con volute floreali e fiori campanulati. Il reperto proviene da una tomba lucana rinvenuta nella proprietà di Andrea Di Ciancia a Roccanova (PZ) e acquistata dal Museo il 29.01.1910.",43,556,1,17,fuori vetrina,108,,,26,26,,,,1,scavo del 1910. Acquisto del 1910
460,,349667,8154,,21/12/2020,Melillo-349667,"Oinochoe lucana a figure rosse. Grossa ansa trilobare, terminante a punta superiormente. Alto collo cilindrico, spalle brevi, corpo ovoidale con largo piede a cercine. Al centro un palestrita nudo, con clamide avvolta sul braccio sinistro e corona di alloro in testa e strigile nella mano destra, sta tra due fanciulle. Quella a sinistra porta il chitone e l'himation che dal capo, trattenuto da una corona radiata, le scende sulle braccia. Quella a destra, vestita dal semplice chitone dorico, sostiene con la mano un cofanetto. Chiudono la scena due satiri caudati nudi, adorni di armille, corona e ghirlanda, che danzano con la gamba sinistra alzata, rappresentata a tutto scorcio. Superiormente la scena è delimitata da motivi floreali stilizzati e in basso da fascia a meandro, interrotto da riquadri crocesegnati. Sulle spalle breve motivo a bastoncello. Sotto l'ansa, due palmette sovrapposte con ai lati volute floreali con fiori campanulati e trapezoidali. Il reperto proviene da una tomba lucana rinvenuta nella proprietà di Andrea Di Ciancia a Roccanova (PZ) e acquistata dal Museo il 29.01.1910.",43,547,1,17,fuori vetrina,108,,,26,26,,,,1,scavo del 1910. Acquisto del 1910
474,,349668,8199,,22/12/2020,Melillo-349668,"Oinochoe lucana a figure rosse. Caratterizzata da una bocca trilobata. Vernice grigiastra, decorazione a figure rosse. Sulle spalle brevi bastoncelli. Dietro l'ansa, palmetta con girali fogliate e fiori trapezoidali ai lati. Al centro un busto maschile. Il reperto proviene da una tomba lucana rinvenuta nella proprietà di Andrea Di Ciancia a Roccanova (PZ) e acquistata dal Museo il 29.01.1910.",43,547,1,17,fuori vetrina,108,,,26,26,,,,1,scavo del 1910. Acquisto del 1910
447,,349670,8129,,24/12/2020,Melillo-349670,"Epichysis apula a figure rosse. Restaurata e ricomposta da vari frammenti.Vernice nera a riflessi metallici. Sulle spalle, scena di sei piccole figure. Nel mezzo una giovane donna seduta su di un ricco seggio, tiene con la sinistra la cetra, appoggiata alle ginocchia; accanto per terra sono presenti un timpano e una cista aperta. Davanti alla donna è un Eros che porge una corona; a sinistra un efebo nudo seduto a cui una fanciulla, con il ginocchio sollevato su uno scoglio, porge una phiale; a destra altro efebo seduto insieme ad un'oca, mentre una fanciulla, anch'essa seduta, sta a guardare. Intorno al corpo, un grifone (bianco e giallo) colpisce col becco una cerva sul dorso, la quale è assalita da un altro grifone; a destra cerva fuggente inseguita da un grifone. Elementi decorativi accessori: sull'ansa, ramoscello di ulivo con bacche bianche, sotto l'ansa e lateralmente, palmette con volute fogliate; sul fondo sporgente delle spalle, motivo ad ovoli; sul piede sporgente, motivo ad onda. Lateralmente, nella zona più espansa del beccuccio, due testine femminili in rilievo. Il reperto proviene da una tomba lucana rinvenuta nella proprietà di Andrea Di Ciancia a Roccanova (PZ) e acquistata dal Museo il 29.01.1910.",43,508,1,17,fuori vetrina,108,,,26,26,,,,4,scavo del 1910. Acquisto del 1910
468,,349671,8179,,25/12/2020,Melillo-349671,"Oggetto fittile di forma ovoidale attraversato da un foro, nella parte lunga. Originariamente era rivestito di latte di calce, ora in parte scrostata. Il reperto proviene da una tomba lucana rinvenuta nella proprietà di Andrea Di Ciancia a Roccanova (PZ) e acquistata dal Museo il 29.01.1910.",65,914,1,17,fuori vetrina,108,,,34,34,,,,1,scavo del 1910. Acquisto del 1910
