id,scheda,nctn,inventario,suffisso,cmpd,titolo,deso,l3,l4,piano,sala,contenitore,comune,via,geonote,dtzgi,dtzgf,dtzs,dtsi,dtsf,stcc,oss
223,,349400,22407,A,21/09/2020,Melillo-349400,"Orecchino in oro in associazione con n. 22407 B. Caratterizzato da disco in lamina lievemente convessa, con godronatura intorno al bordo, sul quale è applicata perpendicolarmente una lamina ondulata con solcature trasversali; decorato da una treccia in filigrana, tra un filo liscio e uno godronato, intorno ad una elaborata composizione fitomorfa, formata da un cespo di acanto e da palmette e fiori campanulati, separati da foglie di acanto; questi elementi sono disposti simmetricamente intorno a una rosetta centrale a tre ordini decrescenti di petali filigranati, dei quali quello interno in lamina sovrapposta, con bottone a sferetta liscia. Sulla parte posteriore del disco sono saldati, al centro, un cilindro cavo in lamina liscia e, in basso, un anello che sostiene un cono rovescio (altezza: cm 4,1), agganciandosi all'anello saldato su un perno inserito nella base del pendente. Il cono, in lamina liscia, ha intorno al bordo un filo godronato e una lamina sovrapposta, decorata da kyma lesbio in filigrana tra una treccia in alto e un filo godronato in basso; intorno al corpo, quattro fili godronati avvolti a spirale; un filo godronato tra due lisci intorno al vertice, terminante con un puntale conico sagomato. Sulla lamina di base del cono è praticato, in posizione decentrata, un foro per l'inserimento del mastice. Lacunoso in parte dell'agganciatura e in una delle foglie di acanto sul disco; lamina lievemente deformata. Proviene dalla tomba Girifalco di Ginosa (Taranto), contrada Chiaradonna, rinvenuta il 13.04.1927. Databile tra la fine del IV e gli inizi del III secolo a.C.",4,42,1,7,18,104,,Contrada Chiaradonna,31,32,15,310,290,3,
224,,349401,22407,B,21/09/2020,Melillo-349401,"Orecchino in oro in associazione con n. 22407 A. Caratterizzato da disco in lamina lievemente convessa, con godronatura intorno al bordo, sul quale è applicata perpendicolarmente una lamina ondulata con solcature trasversali; decorato da una treccia in filigrana, tra un filo liscio e uno godronato, intorno ad una elaborata composizione fitomorfa, formata da un cespo di acanto e da palmette e fiori campanulati, separati da foglie di acanto; questi elementi sono disposti simmetricamente intorno a una rosetta centrale a tre ordini decrescenti di petali filigranati, dei quali quello interno in lamina sovrapposta, con bottone a sferetta liscia. Sulla parte posteriore del disco sono saldati, al centro, un cilindro cavo in lamina liscia e, in basso, un anello che sostiene un cono rovescio (altezza: cm 4,1), agganciandosi all'anello saldato su un perno inserito nella base del pendente. Il cono, in lamina liscia, ha intorno al bordo un filo godronato e una lamina sovrapposta, decorata da kyma lesbio in filigrana tra una treccia in alto e un filo godronato in basso; intorno al corpo, quattro fili godronati avvolti a spirale; un filo godronato tra due lisci intorno al vertice, terminante con un puntale conico sagomato. Sulla lamina di base del cono è praticato, in posizione decentrata, un foro per l'inserimento del mastice. Lacunoso in parte del sistema di agganciatura e in una delle foglie di acanto sul disco; lamina lievemente deformata. Proviene dalla tomba Girifalco di Ginosa (Taranto), contrada Chiaradonna, rinvenuta il 13.04.1927. Databile tra la fine del IV e gli inizi del III secolo a.C.",4,42,1,7,18,104,,Contrada Chiaradonna,31,32,15,310,290,3,
225,,349408,54452,,21/09/2020,Melillo-349408,"Diadema in oro caratterizzato da vaghi a bastoncello e discoidati con nodo erculeo centrale e pendenti a catenella. Le estremità del nodo erculeo terminano ognuna con due fasce, una a petali e un'altra con palmetta tra due fiori; i due cappi ornati a nervature, si completano al centro di una palmetta su girale, motivo ottenuto ""a giorno"", e di una rosacea a otto petali. Dalle estremità, inoltre, per mezzo di ganci in filo ritorto, partono quattro brevi catene con maglia a spina di pesce, desinenti in pendenti ovoidali baccellati, sospesi tramite un anello. All'interno del nodo erculeo, una verga di bronzo permetteva l'aggancio degli altri elementi, forse originariamente legati da un filo deperibile. Si tratta di 10 vaghi lunghi scanalati di cui uno con pendenti di catenelle e 12 vaghi discoidali baccellati in disposizione alternata. La lamina risulta ammaccata in più punti e frammentata nel nodo erculeo e priva di almeno due gruppi di pendenti di catenelle. Il reperto proviene dalla tomba 2 rinvenuta in contrada Frisino a Ginosa (TA) il 19.12.1953. Databile agli inizi del III secolo a.C.",4,38,1,7,18,104,,Contrada Frisino,32,32,1,300,290,3,
227,,349410,54454,,21/09/2020,Melillo-349410,"Orecchino in oro associato al n. inv. 54453. Caratterizzato da disco in lamina aurea con bordo piatto e parte centrale convessa; decorazione costituita da un filo godronato lungo l'orlo, un filo liscio e una serie di spirali contrapposte in filigrana sul bordo e un motivo ad ovoli filigranati intorno alla parte centrale, sulla quale è un'egida esagonale a lati inflessi, con testine stilizzate di serpente ai vertici e gorgoneion a stampo al centro. USl retro è saldato un lungo gancio filiforme di sospensione, con l'estremità inferiore ripiegata ed agganciata ad un perno inserito nella base del pendente. L'attacco è mascherato da una rosetta a cinque petali in lamina filigranata con castone centrale vuoto. Il pendente, a forma di cono rovescio in lamina aurea, è decorato intorno al bordo da un filo liscio e uno godronato e da una lamina sovrapposta con margine inferiore a petali filigranati e motivo a spirali ricorrenti tra due fili lisci, nella parte superiore; sul corpo del cono sono avvolti a spirale tre sottili fili godronati e un altro filo godronato circonda il vertice, con terminale a tre globetti decrescenti. Sulla lamina di base è praticato, in posizione decentrata, un foro per l'inserimento del mastice. Mancano il disco e la rosetta; lamina di base dissaldata; ammaccature e piccole lesioni sul corpo. Il reperto proviene dalla tomba 2 rinvenuta in contrada Frisino a Ginosa (TA) il 19.12.1953. Databile agli inizi del III secolo a.C.",4,42,1,7,18,104,,Contrada Frisino,32,32,1,300,290,3,
234,,349411,214733,,21/09/2020,Melillo-349411,Testa femminile in terracotta ornata da diadema a nodo erculeo sistemato sull'acconciatura a melone secondo un uso in ambito greco.,31,233,1,7,18,45,"Saturo, Santuario della Sorgente",,33,33,2,310,301,4,
236,,349415,6432,,22/09/2020,Melillo-349415,"Bracciale in oro e lega di rame. Caratterizzato da verga a nastro a superficie esterna leggermente convessa con margini rilevati, costituita da un'anima in lega di rame rivestita di lamina aurea; elemento di raccordo tronco-conico schiacciato, definito da due listelli rilevati, uno liscio, l'altro godronato e decorato presso gli attacchi da una serie di foglie filigranate; protome leonina ottenuta a stampo su lamina da due parti saldate perfettamente; particolari anatomici incisi con molta cura; ciocche della criniera rese con un rilievo appena accennato presso l'attacco dei coni di raccordo, molto plastiche sulla fronte, dove si dividono in bande opposte incise con molta cura; arcate sopracciliari rilevate, a sottolineare le cavità orbitali forate, probabilmente per l'inserimento di pietre colorate; falso gancio in sottile filo che partendo dalla parte superiore del muso a cui è saldato, chiudendosi ad occhiello ai lati delle protomi, si incrocia e si innesta nelle fauci spalancate. Verga lesionata in più punti; lacuna tra l'attacco di una delle protomi al cono di raccordo. Dalla tomba 150, rinvneuta a Taranto il 15.08.1912 nell'Arsenale militare. Sulla base dell'analisi stilistica e del contesto tombale si data ai primi decenni del III secolo a.C.",4,30,1,7,19,108,Piazza Ammiraglio Pasquale Leonardi Cattolica,Arsenale militare,32,32,6,300,276,1,
237,,349414,6433,,22/09/2020,Melillo-349414,"Collana in oro. Caratterizzato da doppia maglia costituita da una serie di elementi circolari schiacciati al centro e ripiegati su se stessi, agganciati l'uno all'altro, che si inserisce sulla parte posteriore dei terminali (lungh: cm 2) a protome leonina attraverso due fori; elemento di raccordo tronco-conico, definito alle estremità da un filo interno liscio e uno esterno godronato; protome leonina ottenuta a stampo da due parti saldate perfettamente; particolari anatomici incisi con molta cura ; ciocche della criniera rese con un rilievo appena accennato presso l'attacco dei coni di raccordo, molto plastiche sulla fronte, dove si dividono in bande opposte incise con molta cura; arcate sopracciliari rilevate, a sottolineare le cavità orbitali forate, probabilmente per l'inserzione di pietre colorate; gancio costituito da un anello e un filo ripiegato ad uncino saldati alle fauci delle due teste ferine. Maglie contorte; lamina del cono di raccordo e delle protomi ammaccata. Proviene dalla Tomba 150 rinvenuta a Taranto il 15.08.1912 nell'Arsenale Militare.",4,35,1,7,19,108,Piazza Ammiraglio Pasquale Leonardi Cattolica,Arsenale militare,32,32,6,300,276,1,
238,,349412,6434,A,22/09/2020,Melillo-349412,"Orecchino a doppia testa leonina in oro in associazione con n. 6434 B. Arco costituito da fili lisci avvolti a spirale su un fusto in lamina aurea; all'estremità ingrossata, protome leonina in lamina stampata, con criniera ripartita in ciocche ondulate, occhi cavi per l'inserzione di una pasta vitrea o di una pietra e il muso accuratamente modellato, con incisioni intorno alla bocca, sul naso e nelle bozze facciali. La protome è collegata all'arco da un collarino in lamina decorata in filigrana da una serie di petali e da un tralcio ondulato di edera tra due coppie di fili lisci e godronati. Sull'altra estremità, una protome di minori dimensioni e di modellato meno accurato, con collarino di petali in lamina filigranata delimitato superiormente da un filo godronato. Privo delle pietre incastonate negli occhi delle due protomi e di parte dei petali del collarino minore; arco lievemente deformato. Proviene dalla tomba 150 rinvenuta a Taranto il 15.8.1912 nell'Arsenale Militare. Sulla base dell'analisi del corredo tombale si può collocare cronologicamente nella prima metà del III secolo a.C.",4,42,1,7,19,108,Piazza Ammiraglio Pasquale Leonardi Cattolica,Arsenale militare,32,32,6,300,276,1,
239,,349413,6434,B,22/09/2020,Melillo-349413,"Orecchino a doppia testa leonina in oro in associazione con n. 6434 A. Arco costituito da fili lisci avvolti a spirale su un fusto in lamina aurea; all'estremità ingrossata, protome leonina in lamina stampata, con criniera ripartita in ciocche ondulate, occhi cavi per l'inserzione di una pasta vitrea o di una pietra e il muso accuratamente modellato, con incisioni intorno alla bocca, sul naso e nelle bozze facciali. La protome è collegata all'arco da un collarino in lamina decorata in filigrana da una serie di petali e da un tralcio ondulato di edera tra due coppie di fili lisci e godronati. Sull'altra estremità, una protome di minori dimensioni e di modellato meno accurato, con collarino di petali in lamina filigranata delimitato superiormente da un filo godronato. Lacunoso nelle pietre incastonate negli occhi delle due protomi; lamina ammaccata e parzialmente dissaldata; arco lievemente deformato. Proviene dalla tomba 150 rinvenuta a Taranto il 15.8.1912 nell'Arsenale Militare. Sulla base dell'analisi del corredo tombale si può collocare cronologicamente nella prima metà del III secolo a.C.",4,42,1,7,19,108,Piazza Ammiraglio Pasquale Leonardi Cattolica,Arsenale militare,32,32,6,300,276,1,
240,,349416,6435,,22/09/2020,Melillo-349416,"Anello in oro con castone in granato di colore rosso mattone. Caratterizzato da verga piatta che si espande a formare un castone a losanga, dal profilo continuo con il cerchio, in cui si inserisce un piccolo granato circolare con superficie convessa liscia. Intorno alla gemma il castone è leggermente in rialzo. Cerchio perfettamente regolare. Proviene dalla tomba 150 rinvenuta il 15.08.1912 a Taranto nell'Arsenale militare. Si data al primo venticinquennio del III secolo a.C.",4,28,1,7,19,108,Piazza Ammiraglio Pasquale Leonardi Cattolica,Arsenale militare,32,32,6,300,276,1,
243,,349417,13824,,22/09/2020,Melillo-349417,"Specchio in bronzo di forma discoidale; superficie riflettente leggermente convessa con margine distinto; superficie esterna leggermente concava decorata con una serie di cerchi a rilievo variamente distanziati, margine distinto. Ossidato. Proviene",49,763,1,7,19,108,Piazza Ammiraglio Pasquale Leonardi Cattolica,Arsenale militare,32,32,6,300,276,1,
246,,349421,40186,A,22/09/2020,Melillo-349421,"Orecchino a doppia testa leonina in oro e smalto in associazione con n. 40186 B. Arco costituito da fili intrecciati e avvolti a spirale, recanti all'estremità ingrossata una protome leonina, con criniera ripartita in ciocche ondulate, occhi cavi per l'inserzione di una pasta vitrea o di una pietra e incisioni intorno alle bozze facciali, sul naso e sul muso. La testa è collegata al fusto mediante un collarino in lamina delimitato superiormente da un filo godronato e uno liscio e con decorazione in filigrana, su due zone separate da un filo godronato, formata da una foglia di edera tra due circoletti e da una serie di petali. All'altra estremità, una protome leonina di minori dimensioni e modellato meno accurato, con collarino in lamina liscia. Sistema di agganciatura costituito da un anello saldato sulla bocca della protome maggiore, nel quale è avvolto un filo che si diparte dalla bocca dell'altra. Lamina deformata e lesionata in più punti; si conservano tracce di smalto soltanto sulla foglia di edera. Proviene dalla tomba 77 rinvenuta a Taranto il 13-03-1975, in via Alto Adige.",4,42,1,7,19,108,Via Alto Adige,,32,32,3,261,240,1,
247,,349422,40186,B,22/09/2020,Melillo-349422,"Orecchino a doppia testa leonina in oro e smalto in associazione con n. 40186 A. Arco costituito da fili intrecciati e avvolti a spirale, recanti all'estremità ingrossata una protome leonina, con criniera ripartita in ciocche ondulate, occhi cavi per l'inserzione di una pasta vitrea o di una pietra e incisioni intorno alle bozze facciali, sul naso e sul muso. La testa è collegata al fusto mediante un collarino in lamina delimitato superiormente da un filo godronato e uno liscio e con decorazione in filigrana, su due zone separate da un filo godronato, formata da una foglia di edera tra due circoletti e da una serie di petali. All'altra estremità, una protome leonina di minori dimensioni e modellato meno accurato, con collarino in lamina liscia. Sistema di agganciatura costituito da un anello saldato sulla bocca della protome maggiore, nel quale è avvolto un filo che si diparte dalla bocca dell'altra. Lamina ammaccata e dissaldata in alcuni punti; smalto completamente caduto. Proviene dalla tomba 77 rinvenuta a Taranto il 13-03-1975, in via Alto Adige.",4,42,1,7,19,108,Via Alto Adige,,32,32,3,261,240,1,
248,,349427,40200,,22/09/2020,Melillo-349427,"Anello in oro con castone in granato. Il granato di forma ovale, ospitato nel basso castone, presenta la superficie piatta incisa con la raffigurazione di un crostaceo visto di profilo. La verga, stretta inferiormente, si allarga verso il castone: il profilo esterno è ricurvo. Integro.Dalla tomba 2 rinvenuta il 29-11-1919 a Taranto, contrada Madre Grazia. Fine del III- inizi del II a.C.",4,28,1,7,19,108,,Contrada Madre Grazia,30,31,15,210,190,1,
249,,349428,40201,,22/09/2020,Melillo-349428,"Anello in oro. Il cerchio si presenta liscio sul lato interno, mentre la superficie esterna è riccamente decorata con un fitto intreccio a granulazione e a filigrana. La sezione non è costante, ma va ingrossandosi per poi decrescere di nuovo. In un punto l'ornato è coperto da una verghetta aurea liscia alla quale corrisponde, sullo stesso asse, nel semicerchio opposto, un'interruzione nella granulazione, che mette in luce una saldatura con lisciatura della zona. Tali interventi sono evidentemente da mettere in relazione ad un restauro antico. Stato di conservazione ottimo. Dalla tomba 2 rinvenuta il 29.11.1919 a Taranto, contrada Madre Grazia.
Datato all'ultimo venticinquennio del III a. C.",4,28,1,7,19,108,,Contrada Madre Grazia,27,28,15,-210,-190,1,
250,,349429,40947,,22/09/2020,Melillo-349429,"Bracciale in bronzo caratterizzato da verga spiraliforme piatta all'interno e con profilo convesso all'esterno; le estremità assottigliate e più volte ripiegate si conformano l'una a coda e l'alotra a testa di serpente. Sulla superficie interna della verga, per l'intero sviluppo, serie continua di incisioni trasversali, parallele ed equidistanti. Rinvenuto fuori contesto in contrada Lupoli a Taranto, in proprietà del prof. Lo Zucco, il 24.04.1907.",4,30,1,7,19,108,,Contrada Lupoli,28,28,,,,1,
251,,349420,54173,,22/09/2020,Melillo-349420,"Anello in oro con castone in granato. Ampio castone piatto di forma circolare, con margini assottigliati, ornato al centro da un granato con superficie liscia convessa, trattenuto da un sottile listello in rialzo. La verga, leggermente più larga nel tratto inferiore, è piatta all'interno e con profilo ricurvo all'esterno. Di buona fattura. Scalfitura sulla superficie del castone. Proviene dalla tomba 10 rinvenuta il 13-04-1951 a Taranto, in via C. Battisti. Databile circa alla metà del III secolo a.C.",4,28,1,7,19,108,Via C. Battisti,,32,32,3,261,240,1,
252,,349423,54744,A,22/09/2020,Melillo-349423,"Orecchino a cerchio con Erote in oro in associazione con inv. 54744 B. Cerchio costituito nella metà anteriore da un Erote nudo, in lamina stampata e piatta posteriormente, con un corpo incurvato all'indietro, mani posate sui fianchi ed ali distese, in lamina incisa e saldata dietro le spalle. La metà posteriore è formata da un arco di due fili lisci avvolti a spirale, saldati alla parte posteriore delle gambe dell'Erote e terminanti in filo liscio, che si aggancia ad un anello applicato sulla testa della figura.
Integro. Da una tomba rinvenuta a Taranto l'01.02.1935, in via Nettuno. L'esame del contesto tombale di provenienza consente di attribuire questi orecchini alla seconda metà del III secolo a. C.",4,42,1,7,19,108,Via Nettuno,,32,32,5,250,201,1,
253,,349424,54744,B,22/09/2020,Melillo-349424,"Orecchino a cerchio con Erote in oro in associazione con inv. 54744 A. Cerchio costituito nella metà anteriore da un Erote nudo, in lamina stampata e piatta posteriormente, con un corpo incurvato all'indietro, mani posate sui fianchi ed ali distese, in lamina incisa e saldata dietro le spalle. La metà posteriore è formata da un arco di due fili lisci avvolti a spirale, saldati alla parte posteriore delle gambe dell'Erote e terminanti in filo liscio, che si aggancia ad un anello applicato sulla testa della figura.
Arco lievemente deformato. Da una tomba rinvenuta a Taranto l'01.02.1935, in via Nettuno. L'esame del contesto tombale di provenienza consente di attribuire questi orecchini alla seconda metà del III secolo a.C.",4,42,1,7,19,108,Via Nettuno,,32,32,5,250,201,1,
241,,349425,6478,,22/09/2020,Melillo-349425,"Anello in piombo. Sul castone piatto di forma ellittica è riprodotto in rilievo un caduceo, attributo di Hermes. La verga è a sezione romboidale schiacciata. Verga spezzata e ritorta. Da Taranto, Santa Lucia, rinvenimento del 11-08-1920 (?)
Prima metà del III a. C.",4,28,1,7,19,108,,Contrada Santa Lucia,27,27,4,-300,-251,2,
242,,349426,12461,,22/09/2020,Melillo-349426,"Specchio in bronzo. Forma discoidale, levigata sulla superficie specchiante ed irregolare sul retro.
Corroso. Proviene da Taranto, adespota.",49,763,1,7,19,108,,,27,27,,,,2,
244,,349418,13825,,22/09/2020,Melillo-349418,"Oinochoe trilobata sovraddipinta in stile di Gnathia. Argilla beige; colore rosso; vernice nera con chiazze rossastre dovute ad una cottura imperfetta; sovraddipintura in bianco e giallo. Corpo piriforme; piede ad anello; anse a nastro. Sul collo, coppia di linee orizzontali con grappoli e pampini alternati a viticci. Risparmiate e colorate di rosso la parte interna del piede e la parte inferiore del corpo (ad eccezione di alcune sbavature di vernice). Piede lacunoso; superficie scheggiata; vernice scrostata; sovraddipintura evanida.",43,547,1,7,19,108,Piazza Ammiraglio Pasquale Leonardi Cattolica,Arsenale militare,32,32,6,300,276,2,
245,,349419,13826,,22/09/2020,Melillo-349419,"Tazza biansata a vernice nera. Argilla beige, ingubbiatura arancio, vernice nera con riflessi metallici. Orlo leggermente estroflesso; vasca carenata; alto piede ad anello. Vernice distribuita irregolarmente sulla parte inferiore della vasca. Risparmiati la parte inferiore del corpo e il piede. Scheggiata.",43,595,1,7,19,108,Piazza Ammiraglio Pasquale Leonardi Cattolica,Arsenale militare,32,32,6,300,276,2,
235,,349431,4028,,22/09/2020,Melillo-349431,"Statuetta in terracotta che rappresenta una figura femminile acefala seduta in trono; indossa un chitone con maniche chiuse da tre bottoni a rosette sulla manica destra, di cui uno mancante. Il collo è ornato da collana a vaghi sferici e di ophis (bracciale serpentiforme). Braccia piegate lungo il corpo. Parte sinistra della figura mancante, scheggiata nella parte destra in basso. Rinvenuta nel marzo del 1911 in via duca di Genova a Taranto.",31,232,1,7,19,108,Via Duca di Genova,,26,26,,,,3,
254,,349430,112640,,22/09/2020,Melillo-349430,"Statuetta in terracotta policroma. Raffigura una figura femminile avvolta completamente, sino al collo, da un ampio himation (mantello), che le copre il braccio destro la cui mano stringe sul petto il vestito. I capelli, bipartiti sulla fronte, sono tenuti da un fazzoletto dipinto in bianco e fermari da un diadema a nastro tra i capelli, di autentica lamina, stretta, in oro zecchino. La pettinatura termina sul retro a ""rotolo"". La faccia ha tinta color carne. Le pupille sono nere. Il vestito è dipinto in celeste scuro e rosso cremisi. La statuetta a mezzo tondo è incompleta della parte inferiore e del lato sinistro. La testina è staccata. Restaurata. Proviene dal primo strato nel Pozzo n. 2 indagato durante la costruzione di una palestra all'interno dell'Istituto Pitagora in Corso Umberto a Taranto il 18.12.1958.",31,232,1,7,19,108,Corso Umberto,,27,27,1,-300,-290,3,
255,,349432,34781,,24/09/2020,Melillo-349432,"Frammento di scodella. Argilla arancio scuro; vernice rossa. Relativa a ceramica fine da mensa in terra sigillata di produzione africana di tipo D. Classe ceramica prodotta a partire dalla fine del III-inizi IV secolo fino alla seconda metà del VII; ampiamente diffusa in tutto il bacino del Mediterraneo, così come in Puglia. Il frammento è relativo alla parte dell'orlo a tesa orizzontale con linea incisa presso il labbro. Parete e profilo convesso. Rinvenuto nell'US 7002 del Saggio VII durante le indagini di scavo nella Villa Peripato condotte tra febbraio e aprile del 2004 dall'archeologa Annalisa Biffino sotto la direzione scientifica della dott.ssa Antonietta Dell'Aglio della Soprintendenza per i Beni Archeologici della Puglia.",43,586,1,20,69,108,Villa Peripato,,33,34,,,,8,
256,,349433,34782,,24/09/2020,Melillo-349433,"Frammento di scodella. Argilla arancio scuro; vernice rossa. Relativa a ceramica fine da mensa in terra sigillata di produzione africana di tipo D. Classe ceramica prodotta a partire dalla fine del III-inizi IV secolo fino alla seconda metà del VII; ampiamente diffusa in tutto il bacino del Mediterraneo, così come in Puglia. Il frammento è relativo alla parte dell'orlo verticale a profilo interno convesso, distinto dalla parete. Rinvenuto nell'US 7002 del Saggio VII durante le indagini di scavo nella Villa Peripato condotte tra febbraio e aprile del 2004 dall'archeologa Annalisa Biffino sotto la direzione scientifica della dott.ssa Antonietta Dell'Aglio della Soprintendenza per i Beni Archeologici della Puglia.",43,586,1,20,69,108,Villa Peripato,,33,34,,,,8,
257,,349434,34783,,24/09/2020,Melillo-349434,"Frammento di scodella. Argilla arancio scuro; vernice rossa. Relativa a ceramica fine da mensa in terra sigillata di produzione africana di tipo D. Classe ceramica prodotta a partire dalla fine del III-inizi IV secolo fino alla seconda metà del VII; ampiamente diffusa in tutto il bacino del Mediterraneo, così come in Puglia. Il frammento è relativo alla parte dell'orlo a fascia a sezione triangolare con solcatura all'interno. Parete a profilo convesso. Rinvenuto nell'US 7002 del Saggio VII durante le indagini di scavo nella Villa Peripato condotte tra febbraio e aprile del 2004 dall'archeologa Annalisa Biffino sotto la direzione scientifica della dott.ssa Antonietta Dell'Aglio della Soprintendenza per i Beni Archeologici della Puglia.",43,586,1,20,69,108,Villa Peripato,,33,34,,,,8,
258,,349435,34784,,24/09/2020,Melillo-349435,"Frammento di scodella. Argilla arancio scuro; vernice rossa. Relativa a ceramica fine da mensa in terra sigillata di produzione africana di tipo D. Classe ceramica prodotta a partire dalla fine del III-inizi IV secolo fino alla seconda metà del VII; ampiamente diffusa in tutto il bacino del Mediterraneo, così come in Puglia. Il frammento è relativo alla parte dell'orlo a fascia a sezione triangolare con solcatura lievemente accennata all'interno. Rinvenuto nell'US 7002 del Saggio VII durante le indagini di scavo nella Villa Peripato condotte tra febbraio e aprile del 2004 dall'archeologa Annalisa Biffino sotto la direzione scientifica della dott.ssa Antonietta Dell'Aglio della Soprintendenza per i Beni Archeologici della Puglia.",43,586,1,20,69,108,Villa Peripato,,33,34,,,,8,
