id,scheda,nctn,inventario,suffisso,cmpd,titolo,deso,l3,l4,piano,sala,contenitore,comune,via,geonote,dtzgi,dtzgf,dtzs,dtsi,dtsf,stcc,oss
2,,349179,40140,,09/03/2020,Melillo-349179,"Collana costituita da sei vaghi ovoidali a superficie liscia e nove sferici ottenuti a stampo con doppia matrice, decorati a rilievo con motivi spiraliformi intervallati da punti e presentano una godronatura nel punto di massima espansione. Il terminale (lungo cm 2,6) con foro passante (il diametro misura cm 0,9-1,2) ha una forma conica. Sulla superficie esterna degli elementi c'è un'applicazione di sfoglia aurea. I vaghi risultano sciolti, privi del filo di raccordo; manca uno dei due terminali e la doratura risulta scrostata in più punti. Il reperto proviene dalla tomba 1 rinvenuta il 15.09.1976 a Taranto in via D. Alighieri, angolo via Leonida. Il modello con cui è esposta costituisce una proposta di ricostruzione del modello originale. Per la presenza di vaghi di varia forma si presta a diverse letture interpretative. La forma dei vaghi è attestata nella produzione orafa tarantina già nella prima metà del IV secolo a.C. Sull base bibliografica si propone una datazione alla seconda metà del IV secolo a.C.",4,35,1,7,8,108,Via D. Alighieri,,33,33,5,350,301,8,
3,,349180,40141,,09/03/2020,Melillo-349180,"Collana in terracotta costituita da sei vaghi ovoidali a superficie liscia e nove ottenuti a stampo, decorati a ""granulazione"" con godronatura nel punto di massima espansione. Il terminale ha una forma conica e un foro passante. Il pendente, ottenuto a stampo, rappresenta ipoteticamente una testa maschile; presenta la parte posteriore piana con foro passante verticale. tutti gli elementi presentano una sfoglia aurea sulla superficie esterna. I vaghi risultano sciolti, privi del filo di raccordo. Manca uno dei due terminali e la doratura risulta scrostata in più punti. Proviene dalla tomba 1 rinvenuta il 15.09.1976 a Taranto in via Dante angolo via Leonida.",4,35,1,7,8,108,Via D. Alighieri,,33,33,5,350,301,8,
16,,349189,121477,,09/03/2020,Melillo-349189,"Diadema tubolare in argento sottoposto a una doratura a caldo e caratterizzato da una lamina tubolare, cava all'interno. Risulta privo delle estremità, contorto e lacunoso; all'interno otturato da concrezioni. Rinvenuto il 18.09.1962 nella tomba 1 tra via Minniti, via Dante e via Crispi, a Taranto.",4,38,1,7,8,108,Via Francesco Bruno,Ospedale civile SS. Annunziata,33,33,,330,320,8,
27,,349195,121489,,09/03/2020,Melillo-349195,"Quattro anelli in bronzo, caratterizzati da verga a sezione circolare. Risultano ossidati. Proviengono dalla tomba 1 rinvenuta a Taranto in via Minniti il 18.09.1962. L'intero complesso tombale è databile agli ultimi decenni del IV secolo a.C., più precisamente intorno al decennio 330-320 a.C.",4,28,1,7,8,108,Via Francesco Bruno,Ospedale civile SS. Annunziata,33,33,,330,320,1,
1,,349178,40139,,09/03/2020,Melillo-349178,"Orecchino a navicella in oro in doppia lamina saldata con ardiglione filiforme che si assottiglia verso l'estremità libera; decorata intorno alle estremità da un filo godronato tra due lisci e da un collarino di petali filigranati. Nella parte mediana, in senso verticale, è decorata da due serie di ovoli filigranati, simmetricamente contrapposti ai lati lati del filo godronato tra due lisci, da cui pendono tre globetti di grandezza decrescente. Lamina dissaldata nella curva superiore e ammaccata in più punti; ardiglione lievemente contorto. Dalla tomba 1 rinvenuta in via Dante angolo via Leonida il 15.09.1976. Il corredo tombale da cui proviene è privo di materiale ceramico, ma è stato datato sulla base del confronto con il corredo tombale da cui proviene la coppia di orecchini n. inv. 4565 A e 4565 B, che presenta la stessa associazione di oreficeria (collana a vaghi sferici, anello con scarabeo in oro e orecchino a navicella).",4,42,1,7,8,108,Via D. Alighieri,,33,33,8,350,326,1,
4,,349181,40142,,09/03/2020,Melillo-349181,"Anello con castone a scarabeo mobile in oro. Lo scarabeo è vuoto all'interno, costituito da due lamine auree giustapposte riproducenti l'una il dorso, l'altra la faccia piana recante la raffigurazione. Il dorso, modellato a sbalzo è arricchito con dettagli incisi: triplice linea di separazione delle alette al cui attacco è presente il caratteristico motivo a fascia di segmenti obliqui; linea dorsale a tratteggio, minuscoli occhi circolari ad orbita cava, zampette lisce e base alquanto appiattita. Sul castone è raffigurata una figura femminile seduta con il capo chino in avanti e il corpo di tre quarti. Indossa un lungo chitone a fitte piegoline con le gambe avvolte nell'himation; sulla testa ha un ampio velo che si spiega sulle spalle e discende lungo il lato destro del corpo formando lo sfondo dell'immagine; il braccio destro è abbassato, la mano sul ginocchio. Il filo aureo che regge lo scarabeo attraversa i terminali della verga conformati a cupoletta e si avvolge a più giri intorno al cerchio. La verga è piatta all'interno e arrotondata all'esterno. La lamina risulta rotta in due punti presso la mano sinistra della figura. Lo scarabeo misura cm 1,4x1. Rinvenuto il 15.09.1976 nella tomba 1 a Taranto in via Dante.",4,28,1,7,8,108,Via D. Alighieri,,33,33,8,350,326,1,
5,,349188,54167,,09/03/2020,Melillo-349188,"Anello in oro caratterizzato da un castone su cui è raffigurata una rosetta con il bottone contornato da otto petali, realizzato con una lamina aurea lavorata a sbalzo e quindi opportunamente ritagliata. Il castone, di forma circolare, ha uno sviluppo dal profilo curvilineo; la verga filiforme è interrotta inferiormente, presenta le estremità a testa di serpente, ritorta su ambedue i lati del cerchio. Rinvenuto il 22.04.1954 nella tomba 1 in via Giovine a Taranto.",4,28,1,7,8,108,Via Giovan Giovine,,33,33,8,350,326,1,
6,,349183,54753,A,09/03/2020,Melillo-349183,"Orecchino ad elice in oro in associazione con n. 54753 B; le estremità della spirale è ornata da piccole teste femminili bifronti realizzate a stampo. Corpo tubolare di lamina, cavo all'interno, ingrossato al centro e desinente in due protomi femminili, ciascuna composta da due parti ottenute a stampo e saldate insieme. Le testine, con capelli bipartiti sulla fronte e raccolti sulla nuca in un sakkos con maglia a reticolo, indossano orecchini ad elice, caratterizati da un sottile filo godronato avvolto a spirale. Le protomi sono inserite in un collarino decorato alle estremità da una coppia di fili godronati che racchiudono un filo ondulato in filigrana. Nella parte centrale della spirale si sviluppa una complessa decorazione in filigrana costituita da due tralci floreali che dipartono da un cespo di acanto, con fiore di lilio godronato centrale, in maniera simmetrica, con un motivo di foglie, rosette a quattro e tre petali e campanule, le quali, contrapposte, sono sormontate da una coppia di colombe affrontate, tra le quali è inserita una rosetta a tre petali con bottone centrale. Presso i terminali, sui collarini, sono presenti due fori passanti. Le lamine risultano schiacciate e lacunose; entrambe le protomi sono schiacciate. Proviene dalla Tomba 5 rinvenuta in via Cagliari il 03.07.1954",4,42,1,7,8,108,Via Cagliari,,33,33,3,361,340,1,
7,,349184,54753,B,09/03/2020,Melillo-349184,"Orecchino ad elice in oro in associazione con n. 54753 A; le estremità della spirale è ornata da piccole teste femminili bifronti realizzate a stampo. Corpo tubolare di lamina, cavo all'interno, ingrossato al centro e desinente in due protomi femminili, ciascuna composta da due parti ottenute a stampo e saldate insieme. Le testine, con capelli bipartiti sulla fronte e raccolti sulla nuca in un sakkos con maglia a reticolo, indossano orecchini ad elice, caratterizati da un sottile filo godronato avvolto a spirale. Le protomi sono inserite in un collarino decorato alle estremità da una coppia di fili godronati che racchiudono un filo ondulato in filigrana. Nella parte centrale della spirale si sviluppa una complessa decorazione in filigrana costituita da due tralci floreali che dipartono da un cespo di acanto, con fiore di lilio godronato centrale, in maniera simmetrica, con un motivo di foglie, rosette a quattro e tre petali e campanule, le quali, contrapposte, sono sormontate da una coppia di colombe affrontate, tra le quali è inserita una rosetta a tre petali con bottone centrale. Presso i terminali, sui collarini, sono presenti due fori passanti. Le lamine risultano schiacciate e lacunose; entrambe le protomi sono schiacciate. Proviene dalla Tomba 5 rinvenuta in via Cagliari il 03.07.1954",4,42,1,7,8,108,Via Cagliari,,33,33,3,361,340,1,
8,,349185,54754,,09/03/2020,Melillo-349185,"Anello in oro caratterizato da un castone piatto di forma ellittica, con margini assottigliati inferiormente in maniera non omogenea. La verga ha il profilo esterno arrotondato, mentre all'interno la costolatura iniziale si va progressivamente appiattendo. Sul castone è raffigurata una figura femminile seduta, ipoteticamente Afrodite, rivolta a sinistra, verso la quale è in volo un piccolo Erote. L'incisione, dettagliata nella resa della veste, un lungo chitone a mezze maniche dalle fitte piegoline, ad alta cintura, su cui si sovrappone all'altezza delle gambe a un mantello posto trasversalemente, è invece sommaria e incompleta nel resto della raffigurazione. Il castone, che misura cm 1,6x1,1, presenta delle graffiature; la verga appare in più punti schiacciata, come se fosse stata sottoposta alla morsa di uno strumento. L'anello è stato rinvneuto nella tomba 5 a Taranto in via Cagliari il 03.07.1954.",4,28,1,7,8,108,Via Cagliari,,33,33,8,350,326,1,
9,,349182,62986,,09/03/2020,Melillo-349182,"Diadema tubolare in piombo dipinto di colore giallo per l'imitazione ""povera"" dei monili aurei simili, di cui, però, si perde il rigonfiamento centrale. È caratterizzato da un cilindro ricurvo a sezione irregolare con estremità schiacciate. Risulta spezzato alle punte, il colore è in parte evanido e presenta incrostazioni calcaree. La corda è lunga cm 14. Rinvenuto il 03..07.1954 nella Tomba 13 in via Cagliari a Taranto.",4,38,1,7,8,108,Via Cagliari,,33,33,5,350,301,1,
10,,349187,117019,,09/03/2020,Melillo-349187,"Anello in oro caratterizzato da uno scarabeo in calcedonio di color miele, translucido e privo di incisioni, ben levigato sia nella faccia convessa che in quella piatta. La verga presenta una sezione romboidale con costolatura interna appiattita nel tratto inferiore. Il cerchio si affina procedendo verso le estremità a cupoletta, attraverso le quali passa il perno filiforme che collega il calcedonio all'anello e che si avvolge a quadruplice giro intorno alla verga. Lo scarabeo misura cm 1 x 0,6 Le dimensioni minute fa presupporre che l'anello, in un ottimo stato di conservazione, fosse destinato a un infante. Rinvenuto il 06.04.1960 nella tomba 4 in via Emilia a Taranto.",4,28,1,7,8,108,Via Emilia,,33,33,8,350,326,1,
13,,349190,121474,,09/03/2020,Melillo-349190,"Orecchino ad elice in oro in associazione con n. 121475, caratterizzato da terminali a teste femminili su collarini in filigrana. Caratterizzato da un corpo tubolare di lamina, cavo all'interno, ingrossato al centro e desinente in due protomi femminili bifronti, ciascuna composta da due parti ottenute a stampo e saldate insieme. Le testine, con capeli bipartiti sulla fronte, sono inserite in un collarino decorato alle estremità da una coppia di fili godronati che racchiudono un filo ondulato in filigrana. La lamina risulta schiacciata in alcuni punti. Proviene da una tomba rinvenuta in via Minniti il 18.09.1962. In base all'analisi del corredo l'ambito cronologico si definisce intorno al 330-320 a.C.",4,42,1,7,8,108,Via Francesco Bruno,Ospedale civile SS. Annunziata,33,33,,330,320,1,
14,,349191,121475,,09/03/2020,Melillo-349191,"Orecchino ad elice in oro in associazione con n. 121474, caratterizzato da terminali a teste femminili su collarini in filigrana. Caratterizzato da un corpo tubolare di lamina, cavo all'interno, ingrossato al centro e desinente in due protomi femminili bifronti, ciascuna composta da due parti ottenute a stampo e saldate insieme. Le testine, con capeli bipartiti sulla fronte, sono inserite in un collarino decorato alle estremità da una coppia di fili godronati che racchiudono un filo ondulato in filigrana. La lamina risulta schiacciata in alcuni punti. Proviene da una tomba rinvenuta in via Minniti il 18.09.1962. In base all'analisi del corredo l'ambito cronologico si definisce intorno al 330-320 a.C.",4,42,1,7,8,108,Via Francesco Bruno,Ospedale civile SS. Annunziata,33,33,,330,320,1,
15,,349192,121476,,09/03/2020,Melillo-349192,"Collana in oro costituita da trentotto vaghi lenticolari su lamina formati da due calotte schiacciate saldate nel punto di massima espansione. I terminali sono conici con foro passante, definiti alle estremità da un filo godronato e chiusi in basso da una semicalotta. I vaghi risultano sciolti, i terminali sono privi di filo di raccordo e la lamina è schiacciata in più punti. Il reperto proviene dalla tomba 1 rinvenuta a Taranto il 18.09.1962 nell'area dell'Ospedale SS. Annunziata, tra le vie Minniti, Dante e Crispi. Sia in base al corredo, sia in base agli altri oggetti di oreficeria rinvenuti, facenti parte della stessa parure, la collana è attribuibile alla produzione dell'inizio dell'ultimo venticinquennio del IV secolo a.C. L'intero complesso tombale è databile agli ultimi decenni del IV secolo a.C., più precisamente intorno al decennio 330-320 a.C.",4,35,1,7,8,108,Via Francesco Bruno,Ospedale civile SS. Annunziata,33,33,,330,320,1,
19,,349193,121481,,09/03/2020,Melillo-349193,"Anello in argento dorato caratterizzato da un castone piatto di forma circolare, con margini assottigliati, privo di incisione. La verga ha il profilo esterno arrotondato, mentre all'interno presenta una costolatura appiattita. La superficie del castone risulta in parte abrasa. Il reperto proviene dalla tomba 1 rinvenuta a Taranto in via Minniti il 18.09.1962. L'intero complesso tombale è databile agli ultimi decenni del IV secolo a.C., più precisamente intorno al decennio 330-320 a.C.",4,28,1,7,8,108,Via Francesco Bruno,Ospedale civile SS. Annunziata,33,33,,330,320,1,
20,,349196,121482,,09/03/2020,Melillo-349196,"Specchio in bronzo, di forma discoidale con margine rilevato. Superficie riflettente con bordo ornato da tre cerchi incisi; superficie interna con coppia di linee incise e punto centrale. Risulta ossidato e corroso. Il reperto proviene dalla tomba 1 rinvenuta a Taranto in via Minniti il 18.09.1962. L'intero complesso tombale è databile agli ultimi decenni del IV secolo a.C., più precisamente intorno al decennio 330-320 a.C.",49,763,1,7,8,108,Via Francesco Bruno,Ospedale civile SS. Annunziata,33,33,,330,320,1,
24,,349197,121486,,09/03/2020,Melillo-349197,"Anello in ferro caratterizzato da un castone di forma ellittica. Il reperto risulta in pessimo stato di conservazione a causa dell'accentuata ossidazione; sembra essere stato inciso, come è deducibile dalla depressione centrale che si riscontra. Rinvenuto il 18.09.1962 nella tomba 1 in via Minniti a Taranto. L'intero complesso tombale è databile agli ultimi decenni del IV secolo a.C., più precisamente intorno al decennio 330-320 a.C.",4,28,1,7,8,108,Via Francesco Bruno,Ospedale civile SS. Annunziata,33,33,,330,320,1,
29,,349186,194728,,09/03/2020,Melillo-349186,"Pelike apula a figure rosse su cui è dipinta una testa femminile ornata di orecchini ad elice con la spirale inserita nel lobo, secondo quanto documentato anche dalla monetazione di Siracusa.",43,556,1,7,8,108,,,33,33,8,350,326,1,scavo del 1976 da sequestro
11,,349199,121472,,09/03/2020,Melillo-349199,"Bottiglia apula a figure rosse. Argilla color nocciola, ingubbiatura, vernice nera, sovraddipintura in bianco e giallo. Caratterizzata da labbro estroflesso sagomato; collo a profilo concavo; corpo ovoidale; piede ad anello sagomato. Sul collo, bastoncelli tra linee parallele; sulla spalla, ovuli. Lato A: è raffigurata una donna seduta su pietre, vestita con il chitone con bottoni sulle spalle; indossa calzari, kekryphalos, stephane a raggi, orecchini con pendente, collana a vaghi, perikarpia. Con la mano destra regge una grande phiale, con la sinistra una corona da cui pende una tenia con lacci. Il terreno è reso con una fila discontinua di punti. Nel campo: rosette, dischetto con punti, tenia con lacci, gruppi di tre punti. Sovraddipinti: i calzari, le pietre, i monili, tutti gli attributi e gli elementi in campo. Lato B: è rappresentata una grande palmetta inquadrata da girali multipli, con interposte foglie sfrangiate; in alto ai lati della scena fiore campanulato. In basso, linea continua. Scheggiato. L'orlo ha un diametro di cm 5,4 e il piede un diametro di cm 6,8. La bottiglia proviene dalla tomba 1 rinvenuta a Taranto in via Minniti il 18.09.1962. L'intero complesso tombale è databile agli ultimi decenni del IV secolo a.C., più precisamente intorno al decennio 330-320 a.C.",43,465,1,7,8,108,Via Francesco Bruno,Ospedale civile SS. Annunziata,33,33,,330,320,1,
12,,349202,121473,,09/03/2020,Melillo-349202,"Lekythos in stile di Gnathia. Argilla nocciola, ingubbiatura, vernice nera, sovraddipintura in bianco, giallo e paonazzo. Caratterizzata da bocchino campanulato, collo a profilo concavo distinto, corpo ovoide, piede a disco sagomato al taglio con basso stelo, ansa piatta all'interno, convessa all'esterno con cordolo centrale. Sul collo, bastoncelli; sulla spalla e al distto della scena figurata ovoli graffiti tra coppie di linee graffite. Sulla fronte, Erote nudo incedente verso destra con la testa volta indietro; tiene con la mano destra una corona, con la sinistra una patera; ai lati girali. Nel campo tenia con lacci, gruppi di tre punti. Restaurata, piccole lacune. L'orlo ha un diametro di cm 5,6 e il piede un diametro di cm 7. Il reperto proviene dalla tomba 1 rinvenuta a Taranto in via Minniti il 18.09.1962. L'intero complesso tombale è databile agli ultimi decenni del IV secolo a.C., più precisamente intorno al decennio 330-320 a.C.",43,537,1,7,8,108,Via Francesco Bruno,Ospedale civile SS. Annunziata,33,33,,330,320,1,
17,,349205,121478,,09/03/2020,Melillo-349205,"Tazza biansata. Argilla beige farinosa. Caratterizzata da orlo dritto, vasca carenata, fondo piatto, anse a nastro leggermente sopraelevate. Sbreccatura all'orlo; manca un'ansa. L'orlo ha un diametro di cm 7,5 e il piede un diametro di cm 3. Il reperto proviene dalla tomba 1 rinvenuta a Taranto in via Minniti il 18.09.1962. L'intero complesso tombale è databile agli ultimi decenni del IV secolo a.C., più precisamente intorno al decennio 330-320 a.C.",43,595,1,7,8,108,Via Francesco Bruno,Ospedale civile SS. Annunziata,33,33,,330,320,1,
18,,349203,121479,,09/03/2020,Melillo-349203,"Tazza biansata a vernice nera. Argilla beige, color rosso, vernice nera. Caratterizzata da orlo dritto, vasca poco profonda a profilo convesso, piede ad anello, anse a cordolo. Risparmiato e colorato il fondo del piede, ad eccezione di un cerchio centrale e di alcune sbavature. Vernice scrostata in più punti. L'orlo ha un diametro di cm 8 e il piede un diametro di cm 4,7. Il reperto proviene dalla tomba 1 rinvenuta a Taranto in via Minniti il 18.09.1962. L'intero complesso tombale è databile agli ultimi decenni del IV secolo a.C., più precisamente intorno al decennio 330-320 a.C.",43,595,1,7,8,108,Via Francesco Bruno,Ospedale civile SS. Annunziata,33,33,,330,320,1,
21,,349201,121483,,09/03/2020,Melillo-349201,"Oinochoe in stile Gnathia. Argilla beige, colore rosso, vernice nera, sovraddipintura in bianco e giallo. Caratterizzata da orlo trilobato, corpo ovoide, piede ad anello e ansa a cordolo. Sul collo, copia di linee parallele e motivo a meandro; sul corpo, pampini e grappoli alternati a viticci, sottesi a una linea orizzontale. Vernice scrostata in più punti con chiazze rossastre dovute a cottura imperfetta; sovraddipintura in alcuni punti evanida. Il piede ha un diametro di cm 4. Il reperto proviene dalla tomba 1 rinvenuta a Taranto in via Minniti il 18.09.1962. L'intero complesso tombale è databile agli ultimi decenni del IV secolo a.C., più precisamente intorno al decennio 330-320 a.C.",43,547,1,7,8,108,Via Francesco Bruno,Ospedale civile SS. Annunziata,33,33,,330,320,1,
22,,349204,121484,,09/03/2020,Melillo-349204,"Lekythos a vernice nera. Argilla beige scuro, ingubbiatura leggermente più scura, vernice nera. Caratterizzata da largo bocchino emisferico, corpo ovoide, piede ad anello, ansa annodata costituita da doppio bastoncello. Sul fondo coppia di linee e cerchio impressi. Risparmiati la parte centrale del fondo, l'anello di appoggio e la parte superiore del piede. Vernice leggermente scrostata. L'orlo ha un diametro di cm 6,7 e il piede un diametro di cm 5,2. Il reperto proviene dalla tomba 1 rinvenuta a Taranto in via Minniti il 18.09.1962. L'intero complesso tombale è databile agli ultimi decenni del IV secolo a.C., più precisamente intorno al decennio 330-320 a.C.",43,537,1,7,8,108,Via Francesco Bruno,Ospedale civile SS. Annunziata,33,33,,330,320,1,
23,,349200,121485,,09/03/2020,Melillo-349200,"Bottiglia apula a figure rosse. Argilla arancio, ingubbiatura, vernice nera, sovraddipintura in bainco e giallo. Caratterizzata da labbro estroflesso, sagomato, collo a profilo concavo, corpo ovoidale, piede ad anello sagomato. Sul collo sono raffigurati bastoncelli tra coppie di linee parallele; sulla spalla motivo a onda. Lato A: raffiurato Eros androgino seduto su pietre; indossa calzari, kekryphalos, stephane, collana, bandoliera, orecchini con pendente, perikarpia e periskelides. Con la mano destra regge una phiale, con la sinistra una corona da cui pende una tenia con lacci. il terreno è reso con una fila discontinua di punti. Nel campo: rosette, specchio, gruppi di tre punti. Sovraddipinti: i cazari, gli ornamenti, di Eros, i particolari, delle ali, gli attributi e gli elementi in campo. Lato B: grande palmetta tra tre girali con foglie sfrangiate interposte. In basso, linea continua. Restaurata, piccole lacune integrate. L'orlo ha un diametro di cm 5,1e il piede un diametro di cm 6,4. La bottiglia proviene dalla tomba 1 rinvenuta a Taranto in via Minniti il 18.09.1962. L'intero complesso tombale è databile agli ultimi decenni del IV secolo a.C., più precisamente intorno al decennio 330-320 a.C.",43,465,1,7,8,108,Via Francesco Bruno,Ospedale civile SS. Annunziata,33,33,,330,320,1,
25,,349198,121487,,09/03/2020,Melillo-349198,"Bottone in argento, caratterizzato da una lamina ritagliata in forma discoidale. Lacunoso, superficie corrosa. La lamina costituiva la superficie anteriore di un bottone in materiale deperibile, forse legno. Sulla base del contesto il bottone è databile all'ultimo quarto del IV secolo a.C. Proviene dalla tomba 1 rinvenuta a Taranto in via Minniti il 18.09.1962.",1,4,1,7,8,108,Via Francesco Bruno,Ospedale civile SS. Annunziata,33,33,9,325,301,1,
28,,349206,133053,,09/03/2020,Melillo-349206,"Statuetta in terracotta policroma lavorata a tutto tondo. Rappresenta una figura femminile stante con capelli ricci annodati dietro la nuca, ornata di diadema tubolare e orecchini. Indossa un lungo e ricco chitone con himation che le lascia scoperto il seno sinistro. L'himation è avvolto anche intorno al braccio destro tenuto nel pugno stretto del medesimo braccio in modo da arrcchirne le pieghettature. Tracce di colore azzurro sul braccio sinistro. Testa restaurata. Proviene dalla tomba a camera n. 1 rinvenuta il 6 giugno 1968a Taranto in contrada Carmine, via Romagna angolo via Trentino nella proprietà del costruttore Vito Gattinari.",31,232,1,7,8,108,"Via Romagna, ang. Viale Trentino",,31,32,15,310,290,1,
